{
  "category": "memory.eeprom",
  "checks": [],
  "components": [
    {
      "ref": "U1",
      "select": {
        "part": "part:microchip-24lc256-i-sn"
      }
    },
    {
      "ref": "C1",
      "select": {
        "part": "part:kemet-c0603c104k5ractu"
      }
    }
  ],
  "evidence": [
    {
      "page": 7,
      "source": "source:eeprom-app-microchip-24lc256-y-sn"
    }
  ],
  "id": "block:i2c-eeprom",
  "layout": [
    {
      "kind": "PLACE_NEAR",
      "max_distance": {
        "basis": "ENGINEERING_DEFAULT",
        "conditions": {},
        "note": "G1 engineering design choice; verify during board layout.",
        "unit": "mm",
        "value": 3
      },
      "subject": "C1",
      "target": "U1"
    },
    {
      "kind": "GROUP",
      "subjects": [
        "U1",
        "C1"
      ]
    }
  ],
  "nets": [
    {
      "connect": [
        "port:VDD",
        "U1.pin:8",
        "C1.pin:1"
      ],
      "name": "VDD"
    },
    {
      "connect": [
        "port:GND",
        "U1.pin:1",
        "U1.pin:2",
        "U1.pin:3",
        "U1.pin:4",
        "U1.pin:7",
        "C1.pin:2"
      ],
      "name": "GND"
    },
    {
      "connect": [
        "port:SDA",
        "U1.pin:5"
      ],
      "name": "SDA"
    },
    {
      "connect": [
        "port:SCL",
        "U1.pin:6"
      ],
      "name": "SCL"
    }
  ],
  "parameters": {},
  "ports": [
    {
      "kind": "POWER_IN",
      "name": "VDD"
    },
    {
      "kind": "GROUND",
      "name": "GND"
    },
    {
      "kind": "BIDIRECTIONAL",
      "name": "SDA"
    },
    {
      "kind": "INPUT",
      "name": "SCL"
    }
  ],
  "provenance": {
    "created_by": "agent:/root/implement_pcbknowledge_brief/build_g1_blocks",
    "verified_by": [
      "agent:/root/implement_pcbknowledge_brief/implement_footprint_contracts"
    ]
  },
  "schema": "pcbknowledge.block.v2",
  "verification": "AGENT_VERIFIED"
}
