{
  "category": "power.input",
  "checks": [],
  "components": [
    {
      "ref": "J1",
      "select": {
        "part": "part:wurth-61300411121"
      }
    }
  ],
  "evidence": [
    {
      "page": 1,
      "source": "source:wurth-61300411121"
    },
    {
      "page": 2,
      "source": "source:wurth-61300411121"
    }
  ],
  "id": "block:g2-power-input-header",
  "layout": [
    {
      "edge": "LEFT",
      "kind": "EDGE_PLACEMENT",
      "max_distance": {
        "basis": "ENGINEERING_DEFAULT",
        "conditions": {},
        "note": "D47 connector edge access allowance.",
        "unit": "mm",
        "value": 5
      },
      "subject": "J1"
    }
  ],
  "nets": [
    {
      "connect": [
        "port:VIN",
        "J1.pin:1"
      ],
      "name": "VIN"
    },
    {
      "connect": [
        "port:GND",
        "J1.pin:3",
        "J1.pin:4",
        "J1.pin:2"
      ],
      "name": "GND"
    }
  ],
  "parameters": {},
  "ports": [
    {
      "kind": "POWER_OUT",
      "name": "VIN"
    },
    {
      "kind": "GROUND",
      "name": "GND"
    }
  ],
  "provenance": {
    "created_by": "agent:/root/implement_pcbknowledge_brief/g2_monitor_author",
    "notes": "D47 external supply: pin1 VIN, pins2/3/4 ground. Existing curated contact rating3 A exceeds500 mA budget; working voltage250 V AC; DC use is D47 engineering selection, not a sourced DC rating.",
    "verified_by": [
      "agent:/root/implement_pcbknowledge_brief/g2_source_review"
    ]
  },
  "schema": "pcbknowledge.block.v2",
  "verification": "AGENT_VERIFIED"
}
